id,dimension,categories,description,representative_example,bib_keys,dominant_risks,prescribed_metrics,tera_layers
D1,Agent structure,"Single; Multi-agent flat; Hierarchical; Supervisor-worker",Cardinality and control topology of agents in the system,"AutoGen, MetaGPT, ChatDev, MAGIS","wu2024autogen;hong2024metagpt;qian2024chatdev;tao2024magis;guo2024multiagent","Coordination failure;Multi-agent collusion;Steganographic deception","Multi-agent task success;Role-fidelity rate;Inter-agent message integrity",L5
D2,Retrieval type,"Sparse;Dense;Hybrid;Late-interaction;Graph;Multimodal",Retrieval mechanism and store type,"DPR, ColBERT, BGE-M3, GraphRAG","karpukhin2020dpr;khattab2020colbert;chen2024bgem3;edge2024graphrag","Retrieval poisoning;Jamming;Embedding inversion","Recall@k;NDCG;MRR;Retrieval quality;Faithfulness",L2
D3,Memory type,"Short-term;Long-term;Episodic;Semantic;Procedural",Memory persistence and content category,"Voyager skill library; ReAct scratchpad","wang2024voyager;yao2023react;chen2024agentpoison","Memory poisoning;MemoryGraft;Persistent compromise","Memory recall accuracy;Persistence under benign drift;Poison-injection success rate",L3
D4,Tool integration,"APIs;Databases;Code execution;RPA;Model Context Protocol",Tool surface and invocation protocol,"Toolformer, ToolLLM, MCP","schick2023toolformer;qin2023toolllm;anthropic2024mcp","Tool misuse;ToolHijacker;Plugin Trojan","Tool selection accuracy;Parameter F1;Function-call success;Side-effect correctness",L4
D5,Autonomy level,"Advisory;Assisted;Supervised action;Autonomous action",Degree of human approval per action,"Three-tier model (reactive/deliberative/meta-cognitive)","springer2025agenticarchitectures;hitl2025entropy","Excessive agency (OWASP LLM06);Approval bypass","Approval rate;Escalation rate;Reversal cost",L3-L5
D6,Deployment mode,"Public cloud;Private cloud;Hybrid;Edge;On-prem",Where the components run,"Kubernetes microservices on AWS/Azure/GCP/edge","springer2025agenticarchitectures;mdpi2025mlopstoLlmops","Cross-tenant leakage;KV-cache leakage;IAM misconfiguration","Cross-tenant isolation tests;IAM audit pass-rate;Network egress conformance",L0
D7,Risk class,"Low-stakes;Business-critical;Regulated;Safety-critical",Operational consequence class,"NIST AI RMF risk tiers; EU AI Act high-risk","nist2024genaiprofile;euaiact2024","Domain-specific harm;Regulatory non-compliance","Domain-specific harm rate;Compliance coverage rate","All (cross-cuts)"
D8,Governance level,"Informal;Monitored;Audited;Policy-enforced;Human-approved",Maturity of governance controls,"NIST AI RMF Generative AI Profile; CSA Agentic Profile; AICM","csa2025agenticprofile;csa2025aicm;iso420012023","Audit failure;Accountability gap","Evidence-artifact completeness;Audit pass-rate;Control coverage",C4
